<?xml version="1.0"?>
<!--
////////////////////////////////////////////////////////////////////////////////
//
// Copyright Â© 2008 ESRI
//
// All rights reserved under the copyright laws of the United States.
// You may freely redistribute and use this software, with or
// without modification, provided you include the original copyright
// and use restrictions.  See use restrictions in the file:
// <install location>/FlexViewer/License.txt
//
////////////////////////////////////////////////////////////////////////////////
-->
<configuration xmlns:xsi="http://www.w3.org/2001/XMLSchema-instance" xsi:noNamespaceSchemaLocation="config_enh.xsd">
	<userinterface>
		<collapsewidgets>true</collapsewidgets>
		<hidewidgetscontrol>true</hidewidgetscontrol>
		<banner>invisible</banner>
		<title>E-PRTR</title>
		<locale>en_GB</locale>
		<subtitle/>
		<logo/>
		<stylesheet>com/esri/solutions/flexviewer/themes/lighterside/style.swf</stylesheet>
		<menus>
			<menu id="menuMap" visible="false" icon="com/esri/solutions/flexviewer/assets/images/icons/i_globe.png">Background Map</menu>
			<menu id="menuNav" target="customMenu" visible="true" icon="com/esri/solutions/flexviewer/assets/images/icons/i_nav.png">Navigation</menu>
			<menu id="menuWidgets" visible="false" icon="com/esri/solutions/flexviewer/assets/images/icons/i_widget.png">Tools</menu>
		</menus>
	</userinterface>
	<map initialExtent="-32.2 12.4 54.59 86.92" fullExtent="-150 -50 150 50" showzoomslider="false" scrollwheelzoomenabled="false" lodminlevel="12">
		<basemaps menu="menuMap">
			<mapservice label="Street Map" type="tiled" visible="true" alpha="1" icon="com/esri/solutions/flexviewer/assets/images/icons/i_highway.png" >http://server.arcgisonline.com/ArcGIS/rest/services/ESRI_StreetMap_World_2D/MapServer</mapservice>	
		</basemaps>

		<livemaps>
			<mapservice id="wpaggr" label="Phosphorus loss from agriculture, kg per agricultural area" type="tiled" visible="false" alpha="0.6" url="http://sdkcga6307/ArcGIS/rest/services/PRTR_WEB/EPRTR_diffuse_water_paggr/MapServer" ></mapservice>
			<mapservice id="wprbd" label="Phosphorus loss from agriculture, kg per total RBD area" type="tiled" visible="false" alpha="0.6" url="http://sdkcga6307/ArcGIS/rest/services/PRTR_WEB/EPRTR_diffuse_water_prbd/MapServer"></mapservice>
			<mapservice id="wnaggr" label="Nitrogen loss from agriculture, kg per agricultural area" type="tiled" visible="false" alpha="0.6" url="http://sdkcga6307/ArcGIS/rest/services/PRTR_WEB/EPRTR_diffuse_water_naggr/MapServer"></mapservice>
			<mapservice id="wnrbd" label="Nitrogen loss from agriculture, kg per total RBD area" type="tiled" visible="false" alpha="0.6" url="http://sdkcga6307/ArcGIS/rest/services/PRTR_WEB/EPRTR_diffuse_water_nrbd/MapServer"></mapservice>
		</livemaps>
	</map>
	<navtools>
		<navtool label="Zoom In" icon="com/esri/solutions/flexviewer/assets/images/icons/i_zoomin.png" menu="menuNav">zoomin</navtool>
		<navtool label="Zoom Out" icon="com/esri/solutions/flexviewer/assets/images/icons/i_zoomout.png" menu="menuNav">zoomout</navtool>
		<navtool label="Pan" icon="com/esri/solutions/flexviewer/assets/images/icons/i_pan.png" menu="menuNav">pan</navtool>
		<navtool label="Select" icon="com/esri/solutions/flexviewer/assets/images/icons/i_info_bubble.png" menu="menuNav">pointsearch</navtool>
	</navtools>
	<widgets>
		<widget label="Layer List" invisbtns="close" preload="true" icon="com/esri/solutions/flexviewer/assets/images/icons/i_layers.png"  menu="menuWidgets"  config="com/esri/solutions/flexviewer/widgets/FilterLiveMapsWidget_diffuse.xml">com/esri/solutions/flexviewer/widgets/FilterLiveMapsWidget.swf</widget>
		<widget label="Search" widgetresourcefile="SearchAllWidgetStrings" invisbtns="close" preload="true" icon="com/esri/solutions/flexviewer/assets/images/icons/i_search.png" menu="menuWidgets" config="com/esri/solutions/flexviewer/widgets/SearchWidget_diffuse.xml" baserestserverurl="http://sdkcga6307/ArcGIS/rest/services/PRTR_WEB">com/esri/solutions/flexviewer/widgets/SearchWidgetAllLayers.swf</widget>
		<widget label="ga"  preload="true" icon="com/esri/solutions/flexviewer/assets/images/icons/i_search.png" menu="menuHelp" config="com/esri/solutions/flexviewer/widgets/GoogleAnalyticsWidget.xml" >com/esri/solutions/flexviewer/widgets/GoogleAnalyticsWidget.swf</widget>
		</widgets>
	<links>
		</links>
	<proxytype>php</proxytype>
	<!-- apache|jsp|asp|php -->
</configuration>
