<?xml version="1.0"?>
<!--
////////////////////////////////////////////////////////////////////////////////
//
// Copyright Â© 2008 ESRI
//
// All rights reserved under the copyright laws of the United States.
// You may freely redistribute and use this software, with or
// without modification, provided you include the original copyright
// and use restrictions.  See use restrictions in the file:
// <install location>/FlexViewer/License.txt
//
////////////////////////////////////////////////////////////////////////////////
-->
<configuration xmlns:xsi="http://www.w3.org/2001/XMLSchema-instance" xsi:noNamespaceSchemaLocation="config_enh.xsd">
	<userinterface>
		<collapsewidgets>true</collapsewidgets>
		<hidewidgetscontrol>true</hidewidgetscontrol>
		<banner>invisible</banner>
		<title>E-PRTR</title>
		<locale>en_GB</locale>
		<subtitle/>
		<logo/>
		<stylesheet>com/esri/solutions/flexviewer/themes/lighterside/style.swf</stylesheet>
		<menus>
			<menu id="menuMap" target="standaloneMenu" visible="true" icon="com/esri/solutions/flexviewer/assets/images/icons/i_globe.png">Background Map</menu>
			<menu id="menuNav" target="customMenu" visible="true" icon="com/esri/solutions/flexviewer/assets/images/icons/i_nav.png">Navigation</menu>
			<menu id="menuWidgets" visible="false" icon="com/esri/solutions/flexviewer/assets/images/icons/i_widget.png">Tools</menu>
		</menus>
	</userinterface>
	<map initialExtent="-20.2 34.89 30.59 66.92" fullExtent="-150 -50 150 50" showzoomslider="false" >
		<basemaps menu="menuMap">
			<mapservice label="Street Map" type="tiled" visible="true" alpha="1" icon="com/esri/solutions/flexviewer/assets/images/icons/i_highway.png" >http://server.arcgisonline.com/ArcGIS/rest/services/ESRI_StreetMap_World_2D/MapServer</mapservice>
			<mapservice label="Satellite" type="tiled" visible="false" alpha="1" icon="com/esri/solutions/flexviewer/assets/images/icons/i_satellite.png" url="http://server.arcgisonline.com/ArcGIS/rest/services/ESRI_Imagery_World_2D/MapServer"></mapservice>
		</basemaps>
		<livemaps>
			<mapservice id="sectors" label="Facility Details" type="dynamic" visible="false" alpha="1" url="http://discomap.eea.europa.eu/ArcGIS/rest/services/Air/EprtrFacilities_Dyna_WGS84/MapServer">
				<layers>
						<layer id="0" visible="false" definition="CoordinateStatusCode &lt;&gt; 'MISSING'"></layer>
						<layer id="1" visible="true" definition="CoordinateStatusCode &lt;&gt; 'MISSING'"></layer>
				</layers>
			</mapservice>			
		</livemaps>
	</map>
	<navtools>
		<navtool label="Zoom In" icon="com/esri/solutions/flexviewer/assets/images/icons/i_zoomin.png" menu="menuNav">zoomin</navtool>
		<navtool label="Zoom Out" icon="com/esri/solutions/flexviewer/assets/images/icons/i_zoomout.png" menu="menuNav">zoomout</navtool>
		<navtool label="Pan" icon="com/esri/solutions/flexviewer/assets/images/icons/i_pan.png" menu="menuNav">pan</navtool>
	</navtools>
	<widgets>
		<widget label="Layer List" invisbtns="close" preload="true" icon="com/esri/solutions/flexviewer/assets/images/icons/i_layers.png"   config="com/esri/solutions/flexviewer/widgets/FilterLiveMapsWidget_detail.xml">com/esri/solutions/flexviewer/widgets/ThinFilterLiveMapsWidget.swf</widget>	
		<widget label="Print png" icon="com/esri/solutions/flexviewer/assets/images/icons/i_print_download.png" menu="menuWidgets" invisbtns="close" preload="true" config="com/esri/solutions/flexviewer/widgets/PrintWidget.xml">com/esri/solutions/flexviewer/widgets/ThinPrintWidget.swf</widget>
		<widget label="ga"  preload="true" icon="com/esri/solutions/flexviewer/assets/images/icons/i_search.png" menu="menuHelp" config="com/esri/solutions/flexviewer/widgets/GoogleAnalyticsWidget.xml" >com/esri/solutions/flexviewer/widgets/GoogleAnalyticsWidget.swf</widget>
	</widgets>
	<links>
	</links>
	<proxytype>php</proxytype>
	<!-- apache|jsp|asp|php -->
</configuration>

